{
  "schema_version": "1.0",
  "thread_id": "thread-20260709T232909754-a51accbc",
  "run_id": "20260709T232909754-a51accbc",
  "checkpoint_id": "nav-20260709T232909754-a51accbc",
  "findings": [
    "co-review-ceiling-escalation"
  ],
  "dispositions": [
    {
      "disposition_id": "disposition-co-review-ceiling-escalation-open",
      "finding_id": "co-review-ceiling-escalation",
      "state": "escalated_to_human",
      "rationale": null,
      "fix_evidence_ref": null,
      "review_round": 0,
      "actor_role": "reviewer",
      "recorded_at": "2026-07-09T23:29:49Z"
    }
  ],
  "resolution_summary": "Inline reviewer returned 1 finding(s); disposition trail persisted by orchestrator.",
  "escalation_ref": "",
  "created_at": "2026-07-09T23:29:49Z",
  "updated_at": "2026-07-09T23:29:49Z"
}