{
  "schema_version": "1.0",
  "thread_id": "thread-20260712T012355083-d05aff04",
  "run_id": "20260712T012355083-d05aff04",
  "checkpoint_id": "nav-20260712T012355083-d05aff04",
  "findings": [
    "review-spending-limit-reached"
  ],
  "dispositions": [
    {
      "disposition_id": "disposition-review-spending-limit-reached-open",
      "finding_id": "review-spending-limit-reached",
      "state": "escalated_to_human",
      "rationale": null,
      "fix_evidence_ref": null,
      "review_round": 0,
      "actor_role": "reviewer",
      "recorded_at": "2026-07-12T01:25:37Z"
    }
  ],
  "resolution_summary": "Inline reviewer returned 1 finding(s); disposition trail persisted by orchestrator.",
  "escalation_ref": "",
  "created_at": "2026-07-12T01:25:37Z",
  "updated_at": "2026-07-12T01:25:37Z"
}