{
  "schema_version": "1.0",
  "thread_id": "thread-20260711T204213890-e5647992",
  "run_id": "20260711T204213890-e5647992",
  "checkpoint_id": "nav-20260711T204213890-e5647992",
  "findings": [
    "review-spending-limit-reached"
  ],
  "dispositions": [
    {
      "disposition_id": "disposition-review-spending-limit-reached-open",
      "finding_id": "review-spending-limit-reached",
      "state": "escalated_to_human",
      "rationale": null,
      "fix_evidence_ref": null,
      "review_round": 0,
      "actor_role": "reviewer",
      "recorded_at": "2026-07-11T21:13:33Z"
    }
  ],
  "resolution_summary": "Inline reviewer returned 1 finding(s); disposition trail persisted by orchestrator.",
  "escalation_ref": "",
  "created_at": "2026-07-11T21:13:33Z",
  "updated_at": "2026-07-11T21:13:33Z"
}