{
  "schema_version": "1.0",
  "thread_id": "thread-20260710T213312228-de8951f5",
  "run_id": "20260710T213312228-de8951f5",
  "checkpoint_id": "nav-20260710T213312228-de8951f5",
  "findings": [
    "f1"
  ],
  "dispositions": [
    {
      "disposition_id": "disposition-f1-open",
      "finding_id": "f1",
      "state": "open",
      "rationale": null,
      "fix_evidence_ref": null,
      "review_round": 0,
      "actor_role": "reviewer",
      "recorded_at": "2026-07-10T22:01:59Z"
    }
  ],
  "resolution_summary": "Inline reviewer returned 1 finding(s); disposition trail persisted by orchestrator.",
  "escalation_ref": "",
  "created_at": "2026-07-10T22:01:59Z",
  "updated_at": "2026-07-10T22:01:59Z"
}