{
  "schema_version": "1.0",
  "thread_id": "thread-20260712T004408413-922563c1",
  "run_id": "20260712T004408413-922563c1",
  "checkpoint_id": "nav-20260712T004408413-922563c1",
  "findings": [
    "f1",
    "f2",
    "f1",
    "f2"
  ],
  "dispositions": [
    {
      "disposition_id": "disposition-f1-open",
      "finding_id": "f1",
      "state": "open",
      "rationale": null,
      "fix_evidence_ref": null,
      "review_round": 0,
      "actor_role": "reviewer",
      "recorded_at": "2026-07-12T00:58:27Z"
    },
    {
      "disposition_id": "disposition-f2-open",
      "finding_id": "f2",
      "state": "open",
      "rationale": null,
      "fix_evidence_ref": null,
      "review_round": 0,
      "actor_role": "reviewer",
      "recorded_at": "2026-07-12T00:58:27Z"
    },
    {
      "disposition_id": "disposition-f1-open",
      "finding_id": "f1",
      "state": "open",
      "rationale": null,
      "fix_evidence_ref": null,
      "review_round": 0,
      "actor_role": "reviewer",
      "recorded_at": "2026-07-12T00:58:27Z"
    },
    {
      "disposition_id": "disposition-f2-open",
      "finding_id": "f2",
      "state": "open",
      "rationale": null,
      "fix_evidence_ref": null,
      "review_round": 0,
      "actor_role": "reviewer",
      "recorded_at": "2026-07-12T00:58:27Z"
    }
  ],
  "resolution_summary": "Inline reviewer returned 4 finding(s); disposition trail persisted by orchestrator.",
  "escalation_ref": "",
  "created_at": "2026-07-12T00:58:27Z",
  "updated_at": "2026-07-12T00:58:27Z"
}