{
  "schema_version": "1.0",
  "thread_id": "thread-20260711T170158676-efbbb98d",
  "run_id": "20260711T170158676-efbbb98d",
  "checkpoint_id": "nav-20260711T170158676-efbbb98d",
  "findings": [
    "f1"
  ],
  "dispositions": [
    {
      "disposition_id": "disposition-f1-open",
      "finding_id": "f1",
      "state": "escalated_to_human",
      "rationale": null,
      "fix_evidence_ref": null,
      "review_round": 0,
      "actor_role": "reviewer",
      "recorded_at": "2026-07-11T17:13:12Z"
    }
  ],
  "resolution_summary": "Inline reviewer returned 1 finding(s); disposition trail persisted by orchestrator.",
  "escalation_ref": "",
  "created_at": "2026-07-11T17:13:12Z",
  "updated_at": "2026-07-11T17:13:12Z"
}