{
  "schema_version": "1.0",
  "thread_id": "thread-20260708T094838294-b6a1683a",
  "run_id": "20260708T094838294-b6a1683a",
  "checkpoint_id": "nav-20260708T094838294-b6a1683a",
  "findings": [
    "f1"
  ],
  "dispositions": [
    {
      "disposition_id": "disposition-f1-open",
      "finding_id": "f1",
      "state": "escalated_to_human",
      "rationale": null,
      "fix_evidence_ref": null,
      "review_round": 0,
      "actor_role": "reviewer",
      "recorded_at": "2026-07-08T09:52:19Z"
    }
  ],
  "resolution_summary": "Inline reviewer returned 1 finding(s); disposition trail persisted by orchestrator.",
  "escalation_ref": "",
  "created_at": "2026-07-08T09:52:19Z",
  "updated_at": "2026-07-08T09:52:19Z"
}